Content Title,Content Description,Content Type,Content Last Watched Date (if viewed),Content Completed At (if completed),Content Saved,Notes taken on videos (if taken),
Ruby on Rails 7 Essential Training,"In Ruby on Rails 7 Essential Training, instructor Kevin Skoglund shows you how to create full-featured, object-oriented web applications with the latest version of the popular, open-source Ruby on Rails framework. Kevin steps through the complete process--from the fundamental concepts and best practices behind the Rails framework, to how to build a complete application with dynamic, database-driven content. Using a content management system as an example project, he shows you how to structure databases; build database-driven, object-oriented models; route incoming requests; render pages with dynamic content; and process and validate form data. Kevin finishes with a detailed discussion of controllers and related HTML code.",Course,2022-07-30 01:08 UTC,N/A,false,N/A,
Advanced SQL for Data Scientists,"Many data scientists know how to work with SQL—the industry-standard language for data analysis. But as data sizes grow, you need to know how to do more than simply read and write from a database. This course provides a more sophisticated approach to designing data models and optimizing queries in SQL. Instructor Dan Sullivan begins with the logical and physical design of tables—with particular focus on very large databases—and then presents a deep dive review of indexes, including specialized indexes and when to use them. The next section introduces query optimization and shows how to optimize basic, multi-join, and more complex queries. The course also covers SQL extensions, including user-defined functions and specialized data types. The techniques taught here enable more efficient analysis of large data sets using SQL, statistics, and custom business logic.",Course,2021-10-26 02:17 UTC,N/A,false,N/A,
Jeff Weiner on Leading like a CEO,"During Jeff Weiner's tenure as the CEO at LinkedIn, the company grew its membership base from 33 million to more than 690 million members, increased its revenue from $78 million to more than $7.9 billion, and expanded its team from 338 to over 16,000 employees. Throughout this period of remarkable growth, Jeff developed the company's values and created an organization where compassion is as revered as a healthy bottom line. In this course, Jeff shares his advice on what it takes to be a great leader, using a three-part framework of awareness, synthesis, and inspiration.<br><br>Learn about the importance of maintaining awareness of yourself, your team, your industry, and the world at large. Explore the topic of synthesis, which you achieve through developing your vision and values and by focusing on the most important priorities. Plus, learn about the role of inspiration in leadership, both in terms of being true to your own values and motivating others.",Course,2022-10-12 15:07 UTC,N/A,false,N/A,
How to Make Strategic Thinking a Habit (2020),"Working hard is important—but what's really critical is making sure you're working on the right things. That's what strategic thinking enables you to do. In this course, Dorie Clark shares frameworks and strategies to help you make strategic thinking a daily habit, so that you can make the best use of your time, energy, and effort at work. Discover how to set yourself up for success by carving out time for strategic thinking and adjusting your routine to spark more strategic thoughts. Get tactics for thinking strategically about the tasks and decisions that lie ahead of you, as well as how to revisit past decisions to glean valuable insights. Learn how to change the way you approach your to-do list and examine the root cause of problems to devise better solutions. Plus, Dorie explains how to consistently ask yourself the right questions, so that you don't get off track.",Course,2020-11-30 20:43 UTC,N/A,false,N/A,
After Effects 2020 New Features,"After Effects 2020 is here. Want to know how this new version will impact your motion graphics workflow? This course covers the latest upgrade, focused around the new, more powerful Content-Aware Fill. Discover how to remove an object, create a reference frame, and remove a logo on a smooth surface with this intelligent editing tool. Instructor Mark Christiansen provides practical tips to help you get the most from this forward-looking update.",Course,2020-09-25 12:10 UTC,N/A,false,N/A,
Motion Control 3D: Bringing Photos to Life in Three Dimensions with After Effects and Photoshop CC (2019),"Have you looked at a photo and wished you were there, or wondered what the scene looked like to the photographer? Now you can bring your photos to life by adding motion and depth. Author Rich Harrington reveals how you can transport your photos into a three-dimensional world using Adobe Photoshop and After Effects. The course shows you how to select the right images and resolutions; how to use masks and layers to build a layered composition in Photoshop; and how to animate and light the elements of the scene in After Effects. The techniques is useful for documentary filmmaking, web content, and TV commercials. Rich even shows how to render your project in full 3D for compatible platforms like YouTube, or in a typical broadcast format suitable for television or streaming.",Course,2020-12-14 23:01 UTC,N/A,false,N/A,
Learning End-to-End Testing with Jest,"Testing small parts of an application is fairly easy, but as you assemble systems, the test complexity often grows with the number of interconnected systems. Sometimes, rather than testing just the parts, you want to test the whole process, as one large set. In this course, Chinyelu Ibute shows you how the JavaScript testing framework, Jest, lets you create comprehensive tests so you can verify the functionality of your entire application. Chinyelu starts with the basics of the test-driven development, including the different types. She then shows how to write an end-to-end test for a RESTful web-service application built with Node.js and MongoDB using Jest. Finally, she explains how to test the application workflow from beginning to end, with a high code coverage.",Course,2023-05-09 22:09 UTC,N/A,false,N/A,
8 Git Commands You Should Know,"If you’re a software developer, you probably already know that Git is one of the most useful version control systems out there. But while most developers have mastered the basics of Git, it can be a bit harder to take your skills to the next level and become an advanced Git user. In this course, instructor Ronnie Sheer shows you how to make the move from intermediate Git developer to the realm of finely tuned, source control expert.<br><br>Learn eight power-user Git commands that can save you time, prevent bugs, and more. Find out how to increase your productivity as well as minimize your moments of frustration. Ronnie walks you through a few basic tricks like stashing and adding changes, and then turns to more advanced techniques, such as undoing commits, reverting, and setting up precommit hooks. Test out your new skills with Git-command challenges along the way.
<br><br>This course is integrated with GitHub Codespaces, an instant cloud developer environment that offers all the functionality of your favorite IDE without the need for any local machine setup. With GitHub Codespaces, you can get hands-on practice from any machine, at any time—all while using a tool that you’ll likely encounter in the workplace. Check out the “Using GitHub Codespaces with this course” video to learn how to get started.",Course,2023-12-09 23:55 UTC,N/A,false,N/A,
Managing New Managers,"Managing new leaders comes with a unique set of challenges. Even the most outstanding individual contributor can struggle as they unpack their new role and tackle their increased responsibilities. In this course, learn how to support and inspire new leaders as they make this critical transition. Leadership expert Sara Canaday shows how to identify the unique perspectives and challenges of your new managers, set the expectations for their transition, provide coaching and support, and cultivate the right conditions to help them succeed.",Course,2022-02-05 01:44 UTC,N/A,false,N/A,
Learning C++ (2021),"C++ is one of the most powerful and widely used programming languages of all time. It is also one of the oldest programming languages in use today. In this course, learn the basic elements of this object-oriented programming language that moves the world. Instructor Eduardo Corpeño begins with setting up the development environment and introducing the basic elements of object-oriented programming. Eduardo covers data types such as variables, expressions, assignments, constants, and more. He explains structures, classes, pointers, vectors, and so on. After stepping through the control flow process and a variety of useful functions, Eduardo finishes up with detailed information on opening and working with files.",Course,2022-11-01 04:23 UTC,N/A,false,N/A,
Green Screen Techniques for Video and Photography,"Learning to shoot green screen removes many time and budget limitations. Instead of scouting and shooting on location—a prohibitive expense for most productions—you can digitally recreate the background of your scene. This course takes you through the steps of shooting both photography and video on green screen. Authors Rich Harrington and Abba Shapiro walk you through the process of preparing a live action set, from hanging the backdrop to lighting the subject with strobes; positioning and posing your subject; and completing the scene with post-production techniques in Adobe After Effects, Photoshop, and Premiere Pro. Learn how to composite your footage against a new digital background plate, match the color and exposure, adjust focus, and perform keying for motion.<br><br>This course was created by RHED Pixel. We are pleased to offer this training in our library.",Course,2021-05-31 20:48 UTC,N/A,false,N/A,
Presenting Technical Information with Stories,"Technical information can be dry and hard to understand. But that doesn’t mean your presentation has to be. Storytelling can transform technical talks into dynamic and energizing presentations. In this course, you can learn the top reasons why audiences tune out and discover techniques to make your complex material more memorable and engaging. Instructors Poornima Vijayashanker and Karen Catlin share how to improve your public speaking skills and use storytelling to increase engagement and retention. They show how to identify a story to use, build credibility with your story, and test it to make sure it will engage your audience. The course is filled with real-world examples that show how these lessons impact actual audiences.",Course,2021-01-02 22:27 UTC,N/A,false,N/A,
Find Your Passion: How Padma Lakshmi Found Hers,"Throughout Padma Lakshmi's impressive career, she has assumed a range of roles, including model, author, and executive producer of an Emmy award-winning show: <i>Top Chef</i>. In this course, Padma digs into the life and career experiences that helped her find success. Along the way, she shares practical strategies that can help professionals of all stripes find their unique place in the world, face their fears, and seize the opportunities that come their way. Tune in to get Padma's advice for young women on how to land their dream job, as well as her thoughts on the importance of giving back to your community—both by helping to eradicate inequality and by being vulnerable about your own challenges. Plus, she shares her take on why it's essential to nurture your own health and passions throughout your journey.",Course,2020-12-18 14:59 UTC,N/A,false,N/A,
Jodi Glickman on Pitching Yourself (2018),"Pitching is a universal skill. The time will come when you need to pitch an idea, a project, or even yourself. But you may stumble when the moment strikes—if you don't have a quick and effective process to nail the pitch. In this free course, thought leader Jodi Glickman shares her go-to approach for selling your ideas, your story, and yourself. Learn three easy steps to a successful pitch: destination, backstory, and connecting the dots.",Course,2019-10-27 12:29 UTC,N/A,false,N/A,
Executive Presence on Video Conference Calls,"Learn how to shine on video conference calls. Communication consultant Jessica Chen provides expert advice to look and sound confident, collected, and smart on your next conference call or video presentation. Discover how to prepare your material, how to contribute to the call, and how to incorporate engaging visuals. Get body language, posture, and wardrobe tips to make a powerful impression. Finally, learn the technical details to building a mini ""studio"" for conducting calls, including choosing a webcam, lighting yourself, and placing a microphone for quality sound. <br><br>Note: This course was featured in <i>Market Watch</i>, <i>Inc.</i>, <i>Fortune</i>, <i>Forbes</i>, and <i>Entrepreneur</i>.",Course,2021-03-09 05:33 UTC,N/A,false,N/A,
Revit: AR and VR Workflows,"Getting consistent results in virtual reality means keeping best practices in mind all the way through the development process. In this course, learn why virtual reality and augmented reality are good for business; which tools to use when incorporating immersive technology in your architecture, engineering, or construction practice; and how to create files in Revit that translate through to VR with predictable outcomes. As he shares how to effectively incorporate VR and AR into your practice, instructor Logan Smith details best practices for using your Revit model with VR and AR. Learn how to leverage tools such as Enscape and the Argyle app, how to efficiently create and populate materials in a project, and how to leverage 3D shortcuts to work faster and smarter in Revit.",Course,2022-10-20 20:31 UTC,N/A,false,N/A,
Excel Quick Tips (2020),"The most common questions about using Excel now have timely video answers. This set of quick tips provides helpful, condensed steps you can readily apply to keep on task—whether you're running calculations, setting up a new workbook, fixing a sheet you received, or getting tables ready for presentation. Each video is about one minute long, so you can jump in and get some helpful insights in no time.",Course,2022-04-23 03:42 UTC,N/A,false,N/A,
Fusion 360: Design for Mechatronics,"Fusion 360 is a world-leading mechanical design software. But it also has an overlooked toolset for mechanical–electrical (mechatronic) design. This course teaches engineers and designers how to create simple mechatronic projects and documentation using Fusion 360. Instructor Justin Flett recaps the basics of the software, showing how to generate simple mechanical parts for a robot. He then reviews the advanced tools for plastics and casting design—Draft, Shell, and Rib—commonly used for mechatronics enclosures and casings. He shows how to incorporate components, plus motors and fasteners, into an assembly and how to route wires and cables. Finally, Justin explains how to generate final output, including exploded views and drawing, STEP, and PDF files for use in manufacturing.",Course,2021-08-12 03:54 UTC,N/A,false,N/A,
Tableau for Data Scientists,"If your work requires any sort of graphical visualization of data, chances are you’ve run into Tableau. If you’ve been using Tableau but want to learn how to really harness its full power for data science, join expert Matt Francis in this course as he shows you how to take your skills to the next level. Matt starts with one of the most important features in Tableau: the difference between the green and blue pills (discrete and continuous data) and how this affects every single action Tableau performs. He then shows how to connect to and combine data from different data sources, how to create different charts to make sense of data, ways to transform your data with calculations, and how to create interactive maps. Finally, Matt details ways to present data effectively and how to make engaging dashboards. Whether you want to learn more about Tableau as a whole, or if you just want to improve your knowledge of a single subject, this course will help up your Tableau game.",Course,2022-02-21 19:19 UTC,N/A,false,N/A,
Nano Tips for Negotiating Your Salary with Sho Dewan,"<p>Welcome to our <i>Nano Tips</i> series, where LinkedIn Learning creators deliver impactful lessons in literally seconds. In this installment, discover the secrets to navigating a successful salary negotiation, with key insights from Sho Dewan, the CEO and founder of Workhap and a LinkedIn Top Voice in Job Search and Careers.</p><p>Learn the essentials of talking about salary so you know what to say when it counts. Find out how to research salaries, work closely with recruiters, share your salary expectations, and consider your compensation package beyond just the numbers. Sho walks you through the three most important things to know before you even start the negotiation, with pointers on how to make a counteroffer that’s fair to you and competitive with the market. Along the way, Sho also tells what to say when you’re ready to ask for a raise.</p>",Course,2023-01-24 01:29 UTC,N/A,false,N/A,
Python: Design Patterns,"If you’re a programmer, you’re probably plenty busy, so why not save some time and avoid reinventing the wheel by reusing well-proven design solutions—software design patterns—to improve your code quality? Design patterns encourage programming efficiency and code reuse. In this course, Jungwoo Ryoo takes a look at traditional design patterns as applied to Python. Jungwoo Ryoo covers 15 essential creational, structural, and behavioral patterns to help you solve common coding challenges, while introducing best practices that can help keep your solutions consistent, complete, and correct.",Course,2022-04-15 22:12 UTC,N/A,false,N/A,
LPIC-2 Linux Engineer (201-450) Cert Prep: 2 Linux Kernel,"Are you an IT admin or network administrator needing to show your advanced understanding of and proficiency with Linux? The LPIC-2 Linux Engineer certification demonstrates an advanced proficiency with the Linux operating system and the ability to perform real-world maintenance and administrative tasks, and this series of courses from ITProTV helps you prepare to ace your certification exam. The 201-450 exam focuses on measuring and scaling system performance, configuring the Linux bootloader, advanced storage and network configurations, and other system maintenance tasks. This course, the second in the series, deals with the Linux kernel, including kernel components, kernel modules, how to compile a kernel, and how to monitor a kernel.
 <br><br>
Note: This course was created by ITProTV. We are pleased to host this training in our library.",Course,2022-09-29 15:11 UTC,N/A,false,N/A,
"Management Excellence at Microsoft: Model, Coach, Care","The role of the manager is arguably one of the most important roles in any organization. Providing managers with clear expectations of their role, and how it aligns with the goals of the organization is critical. In this course, learn how Microsoft, a company recognized for its leadership excellence, grows and cultivates managers with a simple and easily applied framework: Model, Coach, Care.
Join Joe Whittinghill, Corporate Vice President, Talent, Learning, and Insights, along with Satya Nadella, Kathleen Hogan, Jason Zander, Jean-Philippe Courtois, and Amy Hood as they share the approach to manager excellence and keys to empowering managers to deliver success. Through the passion and dedication of these members, explore and reflect on management behaviors and how this framework can be applied to your practice as a manager.",Course,2022-03-31 13:50 UTC,N/A,false,N/A,
Carter Beauford: Under the Table and Drumming,"Learn drumming from a world-class musician. Carter Beauford, world-famous drummer for the Dave Matthews Band, performs along with the rhythm tracks from six of the band's best songs, including ""Ants Marching"" and ""Satellite."" Carter covers such topics as left-hand lead and open-hand approaches, fills, double-bass drums, drum set and cymbal setup, time feel, background and influences, and more. He also discusses the early days of the Dave Matthews Band. These lessons are valuable for drummers of all levels, as well as any musician who plays or programs drums.<br><br>

This course was created by Alfred Music. We are pleased to offer this training in our library.",Course,2020-12-30 04:44 UTC,N/A,false,N/A,
RubberHose Animation with After Effects,"RubberHose, a rigging script for Adobe After Effects, makes it easy to animate characters that are packed with personality. In this course, instructor Angie Taylor shares what you need to know to get up and running with this powerful software. Angie kicks off the course by explaining how to create a RubberHose arm and style it with shape layer operators. She then moves on to discuss how to create legs with RubberRig and RubberPin, as well as how to construct an easy walk cycle with RubberHose and the Motion Sketch tool in After Effects. She wraps up by detailing how to fine-tune your character animation and place a character into an animated scene.",Course,2021-04-28 04:39 UTC,N/A,false,N/A,
High-Stakes Communication,"Imagine you’re in a room with a group of stakeholders, each of whom has the power to alter the course of your professional life. If you impress them, they’ll fund your project and champion you as a leader. If you falter, you’ll exit the room with a tarnished reputation. Are you prepared to handle a moment like this, even when it is unexpected? How do you set yourself up for success when so much is on the line? In this course, Jenna Lange shares techniques that can help you manage your message, your mindset, and your stakeholders when the stakes are high. Learn how to build concise, effective messages, manage your body language, avoid common pitfalls, and more. Along the way, Jenna shares case studies and surprising personal experiences that lend a real-world context to each concept.",Course,2020-12-23 01:21 UTC,N/A,false,N/A,
Practical Cybersecurity for IT Professionals,"Learn how to protect your network from cyberattacks through practical, hands-on demonstrations. In this course, Malcolm Shore shows how to use the latest tools to discourage and combat hackers, phishers, and snoops attempting to infiltrate your Windows and Linux systems. Learn what forms cyberattacks can take, as well as the two most common types of protection you can build into your system: Antivirus protection and firewalls. Then, learn how to scan your network for suspicious files, check what services are exposed on your systems, and identify vulnerabilities at the host level with Nessus scans. Malcolm also shows how to combat application-level threats, identify weak points in your web applications,  and monitor packet-level activity on your network.",Course,2022-09-20 23:09 UTC,N/A,false,N/A,
Strategic Thinking (2017),"Strategic thinking is the ability to think on a big and small scale, long and short term, and into the past and the present. While strategic thinking is a valuable skill for everyone in an organization, it becomes increasingly essential as you ascend the ladder. In fact, you may have a difficult time being promoted or succeeding as a leader without it. Yet, no one formally teaches strategic thinking—so it's critical to take the initiative and learn how to do it yourself. This course teaches managers and leaders how to use strategic thinking to guide the direction of their teams and come up with solutions to key business problems. Career and personal branding expert Dorie Clark shows you how to carve out time to think about strategy, gather data, learn from the past, create a vision for the future, and implement strategic thinking within your team.",Course,2018-08-07 19:32 UTC,N/A,false,N/A,
Product Management: Building a Product Roadmap,"A roadmap is a simple but powerful tool for product development. A strong product roadmap supports your business objectives and product strategy. It can help you make decisions and answer critical questions. For example, how do you decide which projects to pursue, and which to defer until later? How can you know which projects will be important a few months from now, when the market is changing so quickly? And how do you get all the diverse groups in your organization aligned behind one particular plan?<br><br>

This course shows how to build a product roadmap for your business—and gain critical stakeholder buy-in. See examples of what roadmaps might look like, and spend time learning the tools and techniques necessary to map the projects for your specific organization. Instructors Teg Grenager and Eldad Persky show you how to create strong, dynamic roadmaps that can help ensure that your team is working on the right projects at the right time.",Course,2018-12-05 17:03 UTC,N/A,false,N/A,
CONTENT METADATA NO LONGER EXISTS - urn:li:lyndaCourse:2819030,CONTENT METADATA NO LONGER EXISTS - urn:li:lyndaCourse:2819030,Course,2020-12-26 02:40 UTC,N/A,false,N/A,
C Programming for Embedded Applications,"<p>From medical devices to a car’s dashboard to a video game controller, embedded systems are all around us. Learning to write embedded software in C will help you deliver applications that are small, efficient, and fast. </p>
<p>
In this course, instructor Eduardo Corpeño explains how C programming and the Internet of Things combine in embedded applications—software that permanently resides on a device—and demonstrates the challenges unique to this type of programming, ranging from memory, storage, and power limitations to hardware awareness.",Course,2022-11-09 15:35 UTC,N/A,false,N/A,
