Introduction to Business Analytics,"Data is an extremely valuable resource. But without study, it can’t be used to create a data-informed strategy. Business analytics helps organizations leverage data to make better, more informed decisions. This course is a basic introduction that lays out the foundations of analytics in an easy-to-understand and engaging manner. Expert John David Ariansen explains why data is so powerful, what insights really matter, and how to use common analysis tools and techniques. Additionally, John David explores data source maps, database management, and all the various data sources that may be encountered. By the end of the course, you should have the skills necessary to start collecting, tracking, and analyzing a variety of data, including sales, marketing, and psychographic metrics.<br><br>

<br><br>This course was created by <a href=""http://www.onlymadecraft.com"" target=""_blank"">Madecraft</a>. We are pleased to host this content in our library.<br><br><img src=""https://media.licdn.com/media/AAYAAgCwAAoAAQAAAAAAAHppnBQxgeyWS2CsU3aDDPcMgw.jpg"" height=""25%"" width=""25%"">",Course,2022-03-09 04:53 UTC,N/A,false,N/A,
Data Analytics: Graph Analytics,"Since the inception of data analytics, the way in which analysts view and interpret data has evolved tremendously. New technologies, tools, and approaches have advanced what's possible with data analytics, and network analysis is no exception. In this course, longtime data analyst and data visualization expert Heather Johnson shares the fundamentals of using graph analytics, or network analysis, when analyzing data. Heather begins by reviewing the components of a network analysis and detailing the advantages of using a graph analytics approach. She then walks through key applications of using graph analytics when reviewing data. To wrap up the course, Heather discusses career opportunities within the realm of graph analytics. Upon completion, you’ll be equipped with the knowledge of what graph analytics is and how it can be leveraged within your analytics career.<br><br>This course was created by <a href=""http://www.onlymadecraft.com"" target=""_blank"">Madecraft</a>. We are pleased to host this training in our library.<br><br><img src=""https://media.licdn.com/media/AAYAAgCwAAoAAQAAAAAAAHppnBQxgeyWS2CsU3aDDPcMgw.jpg"" height=""20%"" width=""20%"">",Course,2022-05-21 04:07 UTC,N/A,false,N/A,
Learning the Python 3 Standard Library,"Python libraries can cut your development time and reduce your frustration with coding. In this Python 3 course, follow Kathryn Hodge as she walks through the Python standard library. Discover how familiarizing yourself with its facilities can make writing code in this concise, elegant language a little easier. Familiarize yourself with the library's built-in functions, math modules, and input and output modules. Learn how to get information from the Internet with the HTTP module, and more.",Course,2020-05-18 16:16 UTC,N/A,false,N/A,
Software Development Life Cycle (SDLC),"From scrum to Six Sigma, there's an abundance of options for architecting an organization's workflow. And since there's no one-size-fits-all approach to software development, it's important for software project managers, architects, and team leads to grasp the different options at their disposal before making a decision that affects the budgeting, staffing, and management of software delivery. This course zooms out on the software development landscape to provide a high-level look at a variety of software development life cycle (SDLC) approaches—from traditional methods to more modern processes. Instructor Shashi Shekhar provides a brief overview of each method, highlighting how each one is unique and can be applicable today. Learn about lean, kanban, DevOps, and more.",Course,2022-07-28 01:12 UTC,N/A,false,N/A,
Building Modern Projects with React,"Learn about some of the most important tools in the React ecosystem that help you simplify development and manage the complexities of state, side effects, structure, and styling. Instructor Shaun Wassell shows how to create a basic React project, and then explains how to add Redux, create thunks, use selectors, work with styled-components, perform testing, and more.",Course,2023-03-03 20:30 UTC,N/A,false,N/A,
DJ Patil: Ask Me Anything,"DJ Patil—the former US chief data scientist—boasts a unique perspective on the future, risks, and all-around power of data. In addition to shaping policies at the White House, he's authored influential academic papers and served as head of data products at LinkedIn, where he helped to coin the term ""data scientist."" In this weekly series, DJ tackles questions posed by LinkedIn members, diving into topics ranging from data security to the future of data science. Tune in every Wednesday for a fresh set of answers.",Course,2021-11-29 06:53 UTC,N/A,false,N/A,
How to Stop Wasting Time in Meetings,"Does anyone love meetings? Let's face it—meetings have a bad reputation, and we probably all know why. They can waste time, add confusion, and lack clear takeaways. The good news is that they don't have to be this way. In this course taught by creativity-productivity expert Samantha Bennett, Sam explains the various ways in which you can make meetings more impactful. She walks through how you can set a clear meeting purpose based on the stakeholders and the type of meeting, and how to get aligned on a direction and ensure all voices and perspectives are heard. She also imparts her rules for effective meetings, how to follow up, and how to hold folks accountable after your meeting. If you take the time to watch this course, you might just find yourself making more of your time in your next meeting.
<br><br>This course was created by <a href=""http://www.onlymadecraft.com"" target=""_blank"">Madecraft</a>. We are pleased to host this training in our library.<br><br><img src=""https://media.licdn.com/media/AAYAAgCwAAoAAQAAAAAAAHppnBQxgeyWS2CsU3aDDPcMgw.jpg"" height=""20%"" width=""20%"">",Course,2022-03-23 22:51 UTC,N/A,false,N/A,
Succeeding in DevOps,"DevOps engineer is one of the most in-demand tech jobs on the market. But since this role is still relatively new, aspiring DevOps engineers may have a somewhat murky understanding of what the position entails. In this course, Laura Stone clearly outlines what's expected of DevOps practitioners, as well as what it takes to become a DevOps engineer (and how to excel once you've landed the job). She begins by highlighting the basic qualifications and training needed to land a job as a DevOps practitioner. Next, she provides a technical roadmap for the skills needed to gain an entry-level role in DevOps; shares tips from a DevOps recruiter;  and provides steps for measuring progress and achieving your goals throughout your DevOps career.",Course,2021-03-25 15:06 UTC,N/A,false,N/A,
Java Object-Oriented Programming,"Are you familiar with Java but want to get the most out of your Java programs? In this course, Kathryn Hodge teaches the basics of object-oriented programming in Java, so you can write code that’s secure, scalable, and easier to troubleshoot. Kathryn begins by showing how object-oriented principles are embedded into the Java language from the first code file you create. She looks at how classes, instances, and constructors embody the idea of representing real-life objects in code. Kathryn not only shows how to apply object-oriented principles in your own programs, but also explains how Java leverages these principles behind the scenes. While many resources about object-oriented programming focus on abstract examples, the goal of this course is to get away from the abstract and focus more on practical examples of these principles in Java. Along with deep dives into the source code, this course also provides several challenges and solutions to help you apply what you’ve learned.",Course,2023-02-23 04:54 UTC,N/A,false,N/A,
Python Parallel and Concurrent Programming Part 1,"Parallel programming unlocks a program’s ability to execute multiple instructions simultaneously, increases the overall processing throughput, and is key to writing faster and more efficient applications. Curious about how parallel programming works in the real world? In this course, join instructors Barron and Olivia Stone as they introduce the basics of parallel programming in Python, providing the foundational knowledge you need to write more efficient, performant code. Barron and Olivia explain concepts like threading and mutual exclusion in a fun and informative way, relating them to everyday activities you perform in the kitchen. To cement the ideas, they demo them in action using Python. Each lesson is short and practical, driving home the theory with hands-on techniques.",Course,2021-12-27 17:41 UTC,N/A,false,N/A,
SOLIDWORKS: Designing Bearings,"Bearings are an amazing innovation in mechanical engineering. They can ensure that a part rotates or slides the way you want it to, and can ensure that parts don't move in directions they shouldn't. They can reduce friction, saving energy in your design. In this course, mechanical engineer and certified SOLIDWORKS expert Ryan Krawchuk teaches you the fundamentals of bearings, and models a series of different mechanical bearings, creating complex and dynamic multipart assemblies that behave as they would in the real world. Ryan covers three types of bearings—ball, roller, and spherical bearings—and shows how to design their constituent parts in SOLIDWORKS and combine those parts into a final bearing assembly.",Course,2023-04-05 16:14 UTC,N/A,false,N/A,
React: Building Styles with CSS Modules (2017),"React styles and CSS styles haven't always agreed in the use of inline styling. As React development has grown, developers have figured out more and more ways of smoothly integrating and maintaining a style with their code. Whether you need to style a React-based user interface or want to create dramatic animation, this course gives you the keys you need to build attractive and maintainable style using React and CSS modules.",Course,2019-10-27 04:42 UTC,N/A,false,N/A,
Interaction Design: Dashboards and Visualization,"When telling a story with data, you need the right types of visuals to convey meaning. In this course, instructor Diane Cronenwett covers techniques and best practices on applying design principles to dashboards and data visualizations. Diane shows you how to determine your user's goals, so that you can design effective dashboards. Diane walks you through several chart options, then dives into the role of color in designing an effective dashboard. She explains layout, hierarchy, dashboard interactivity, and the importance of creating a clear design for your tabular data. Diane concludes by showing you how to bring together dashboard conceptualization, layout considerations, visual design considerations, and dashboard interactivity.",Course,2022-01-20 19:24 UTC,N/A,false,N/A,
Learning SQL Programming (2017),"SQL (Structured Query Language) is a common tool for retrieving data from relational databases such as SQL Server, MySQL, MariaDB, and PostgreSQL. This course provides an introduction to this core programming language. Learn how to request data from a server, limit and sort the responses, aggregate data from multiple tables with joins, and edit and delete data. Instructor Scott Simpson also shows how to perform simple math operations and transform data into different formats.",Course,2018-12-06 20:58 UTC,N/A,false,N/A,
Java Practice: Exception Handling,"<p>Java is a versatile, object-oriented programming language that is designed to run on a wide variety of platforms. Any machine that has a Java Virtual Machine, or JVM, can run Java apps. For that reason, Java is commonly used in a wide range of applications, including web, mobile, and desktop. In this course, instructor Todd Perkins, who has developed more than a dozen popular apps and games, uses a series of practical challenges to test your understanding of Java exception handling, so you can improve your programming problem-solving skills. Challenges include catching the exception, as well as handling an unsupported operation, a hidden exception, multiple threads, and nested exceptions.</p>
 
<p>This course includes Code Challenges powered by CoderPad. Code Challenges are interactive coding exercises with real-time feedback, so you can get hands-on coding practice alongside the course content to advance your programming skills.</p>",Course,2024-01-08 22:45 UTC,N/A,false,N/A,
Excel: Tips and Tricks (2018),"Want to take your Excel game to the next level? In this course, veteran Excel trainer and instructor Dennis Taylor shares powerful tips, tricks, and shortcuts that can help you leverage more of what Excel has to offer. Learn time-saving tricks for creating formulas rapidly, accelerating data entry, and navigating within worksheets efficiently. Plus, discover drag and drop techniques, formatting shortcuts, charting and PivotTable tips, and much more.</br></br>

Note: This course was recorded on Excel for Office 365; however, most of the contents will benefit anyone using Office 2019 or 2016.",Course,2021-02-07 03:21 UTC,N/A,false,N/A,
GPT-4: The New GPT Release and What You Need to Know,"<p>The next generation of GPT is here, and it’s time to get up to speed. The latest version, GPT-4, takes all the core functionalities of GPT-3.5 and reworks them for more reliable, consistent results and higher performance delivered at speed. Join data science consultant and AI expert Jonathan Fernandes to get a sneak peek at what’s new with GPT-4, in this approachable, easy-to-follow course designed for both technical and non-technical learners.</p><p>Explore the wide variety of tasks that GPT-4 can perform with accuracy and ease, as you develop your understanding of how large language models function in interactive natural language processing. Along the way, gather insights from Jonathan on model specifications, decoders, parameters, training tools such as PPO reinforcement learning, common limitations, HELM, and more. Upon completing this course, you’ll have the skills you need to know to get started with GPT-4 and select the model that’s best for you.</p>",Course,2023-09-03 15:50 UTC,N/A,false,N/A,
Critical Thinking for Better Judgment and Decision-Making,"The pace of change and volume of information we encounter in daily life make it hard to think through decisions. Instead, people often rely on biases and rules of thumb, which trap them into drawing faulty conclusions. The most successful teams use critical thinking—objective and rational analysis—to illuminate the wisest conclusions. This course prepares leaders to hone the critical thinking skills of their entire organization. Learn how to upgrade critical thinking to avoid deceiving fallacies, spot misleading cognitive biases, craft better arguments, hone judgment, and improve decision-making. Instructor Becki Saltzman teaches skills that will improve how your company or team innovates, tackles challenges, and responds to change.",Course,2021-01-06 14:49 UTC,N/A,false,N/A,
DevOps for Databases in Azure with MySQL and Terraform,"If you’re already familiar with DevOps practices and are wondering if these methods can apply to databases as well, this is the course for you. In this project-focused course from CloudSkills, instructor Michael Levan reveals how DevOps for databases is not all that different from what you might already be doing. Michael starts off with some basics of DevOps for databases, like why it’s important, and the tools you use in DevOps today that can be used with databases. He then gets into the project, showing how to create a MySQL database with Terraform, and how to take that same Terraform configuration and automate, via CI/CD, the MySQL dataset creation with Azure DevOps. If you’ve been wondering why you might want to use DevOps for databases, this course provides some answers—you no longer have to hold up app delivery; collaboration between teams means better deployment outcomes, procedures, and automation—along with a project you can work on that illustrates these benefits.

<br><br>

Note: This course was created by CloudSkills.io. We are pleased to host this training in our library.",Course,2023-02-02 00:55 UTC,N/A,false,N/A,
Understanding the Impact of Deepfake Videos,"Imagine not being able to trust what you see or hear when you watch a video online. Deepfakes are manipulated media—video or audio—where a person has been replaced with someone else's likeness and made to appear as if they said or did something that never happened. Deepfake videos use artificial intelligence and can appear very convincing, even to a trained eye. When used to mislead audiences, deepfake videos can be disastrous. However, they can have useful benefits too—like offering AI-assisted video reshoots. In this introductory course, senior staff instructor Ashley Kennedy offers a useful introduction to the dangers and benefits of deepfake videos. She also provides a high-level overview of deepfake technology and puts forward some tools to identify deepfake videos, as well as suggestions for what to do when you suspect or spot a deepfake video.",Course,2020-12-06 13:51 UTC,N/A,false,N/A,
GraphQL Essential Training (2018),"GraphQL—a query language for APIs that was originally built by Facebook—makes it easier for you to get the data you actually need from a query. In this course, learn how to get started with GraphQL. Instructor Emmanuel Henri walks through how to set up GraphQL, explores the GraphQL schema, and goes over the basic types and fields. He also shows how to set up persistence—including how to use SQL and MongoDB with GraphQL; covers how to add new items with mutations; and shares how to leverage some advanced features in your queries.",Course,2018-11-25 16:48 UTC,N/A,false,N/A,
Managing Career Burnout,"For many professionals, remaining constantly connected and on task can feel like a requirement for success. Long hours and chronic exhaustion are normalized—if not celebrated—in many workplaces. But a lack of boundaries between work and life can cause even the hardest workers among us to wind up resentful and unhappy—even in jobs that once fulfilled them. In this course, instructor Emilie Aries breaks down what burnout is, what causes it, and how to take back your power and energy. Discover how to identify your burnout triggers—whether it's lack of agency, rest, community, or purpose—and take steps to reframe your situation and get help. Plus, get practical strategies to  ensure that you kick burnout to the curb for good.",Course,2021-09-09 12:28 UTC,N/A,false,N/A,
Learning React.js (2018),"React.js is a JavaScript library designed to make the process of building user interfaces more simple and intuitive. Design basic views for each state in your application, and React will efficiently update and render just the right components when your data changes. In this course, Eve Porcello helps you get started with React, guiding you through the interface design of a sample full-stack bulletin board app. She reviews components, properties, and component state, as well as the foundational parent/child relationships within React. Eve also describes the lifecycle of components and how developers can trigger creation, lifetime, and teardown events. The course wraps with a chapter dedicated to building an enhanced version of the app by updating components and loading data from an API. Plus, learn how to generate an optimized production build with create-react-app.",Course,2018-11-09 17:50 UTC,N/A,false,N/A,
Guy Kawasaki on Turning Life Wisdom into Business Success,"Get career advice from a real ""wise guy."" In this course, based on his book <i>Wise Guy</i>, one of the world's leading corporate evangelists, Guy Kawasaki, talks about how he built his career. Learn how he landed his first real job in the jewelry business—which turned out to be surprisingly useful training for the tech world. Find out why some of the riskiest moves he made at Apple—disparaging a potential partner and trading jabs with Steve Jobs—paid off. Guy also reveals how taking up surfing at the age of 62 sparked a new passion. In total, Guy covers everything from moral values to business skills to parenting. As he writes, “I hope my stories help you live a more joyous, productive, and meaningful life. If <i>Wise Guy</i> succeeds at this, then that’s the best story of all.”<br><br>

This course was created by <a href=""https://genconnectu.com/"" target=""_blank"">genconnectU</a>. We are pleased to offer this training in our library.",Course,2021-01-20 23:09 UTC,N/A,false,N/A,
8 Things You Must Know in Python,"There are many beginner Python tutorials, but to build useful applications, you need to move beyond the basics. This course helps you on the journey to writing intermediate-level Python code. Instructor Jonathan Fernandes presents eight things that you should know how to do in Python. Topics include the Python any() and all() methods, using enumerate() and zip() methods, min() and max(), and more. For each topic, Jonathan provides a hands-on approach and then gives you a challenge (with solutions) to practice.
<br><br>
Note: This course was created by Jonathan Fernandes. We are pleased to host this training in our library.",Course,2021-08-31 10:26 UTC,N/A,false,N/A,
Lightroom for Faces (2019),"Retouching faces used to be challenging without using Adobe Photoshop, but recent improvements in Lightroom—involving the Spot Removal tool, Clone Stamp tool, Adjustment Brush tool, syncing capabilities, and more—have made it much simpler to use Lightroom as a stand-alone solution. This course shows you how to save time by staying in Lightroom instead of Photoshop. Discover how to remove unwanted blemishes, make local or targeted adjustments, enhance eyes, smooth skin, and more.",Course,2020-09-28 17:39 UTC,N/A,false,N/A,
Building React and ASP.NET MVC 5 Applications,"React.js is a popular framework that's especially suited to building web apps with ASP.NET MVC 5, but integrating the two frameworks can be challenging. In this course, instructor Kazi Nasrat Ali steps through how to wire these two frameworks together to develop full-stack React and ASP.NET MVC 5 web apps. Learn how to build a front end with React.js and a backend with ASP.NET MVC 5 and Entity Framework by creating a full-stack web app for a restaurant. Create user logins, add shopping cart functionality to your app, secure the API, and optimize for mobile. Upon wrapping up this course, you'll have the skills you need to combine the powers of React.js and ASP.NET MVC 5 to create high-quality, impactful webpages.",Course,2021-07-20 04:29 UTC,N/A,false,N/A,
Succeeding in a New Role By Managing Up,"The start of a career is an exciting yet vulnerable place to be. You have the freshness and energy on your side, but you also have very little experience with how your industry and your new company actually work. The good news is you’re not alone. We’ve all been there before. This course brings together advice from a diverse set of experts, such as Oscar-winning actor Ed Norton and Adam Grant, the youngest tenured professor at Wharton. They explain how to develop a fearless mindset and build the productivity and networking skills you need to succeed in a new role. By understanding the dynamics that early-career employees face and “managing up” by building strong relationships, you can gain the confidence and support you’ll need to thrive.<br><br>

This course includes videos from: <br>
<b>Edward Norton</b>, Oscar-winning actor and founder of CrowdRise<br>
<b>Kathryn Minshew</b>, founder and CEO of The Muse, a career-discovery platform<br>
<b>Adam Grant</b>, Wharton professor and expert in motivation and behavior<br>
<b>Sarah Robb O'Hagan</b>, executive, activist, entrepreneur, and the CEO of Flywheel Sports<br>
<b>Simon O. Sinek</b>, author of <i>Start with Why: How Great Leaders Inspire Everyone to Take Action</i><br>

Note: This course was produced by <a href=”https://edge.bigthink.com/users/sign_up” target=”_blank”>Big Think</a>. We are pleased to host this content in our library.",Course,2021-07-30 23:25 UTC,N/A,false,N/A,
Career Advice from Some of the Biggest Names in Business,"What if you could get career advice from the world's most influential thinkers, leaders, and innovators? People who have run the top companies, created the most beloved brands, transformed industries, and changed the world? Now you can. This course brings together the best insights from our collection of interviews with LinkedIn Influencers. CEOs such as Richard Branson, Bill Gates, Indra Nooyi, and Meg Whitman reveal what it takes to get your foot in the door and then work your way up. Discover why Starbucks founder Howard Schultz thinks that conviction is so critical, how Oprah found her vision, and what actress Priyanka Chopra does to find the next challenge. Each interview provides short and thoughtful tips you can use to propel your own career in the right direction.",Course,2020-04-24 14:20 UTC,N/A,false,N/A,
