The Step-by-Step Guide to Building your Thought Leadership on LinkedIn,"Generating business, reaching new clients, or acting as a spokesperson for your company or product—there are many benefits to building your thought leadership on LinkedIn. Whether you are a seasoned professional or just starting out, Alexandra Galviz (""Authentic Alex”) can help. Alex is a Linked Top Voice for the UK and the cofounder of #LinkedInLocal. In this course, she offers a step-by-step guide to using LinkedIn to reach audiences and establish your expertise. She explains how to craft an authentic voice, grow your audience of brand ambassadors, and create courageous content. Each chapter is filled with examples of her favorite thought leaders in the UK, from entrepreneurs to business leaders. By the end, you’ll be sharing your stories in an authentic and relatable way and creating a deeper connection with your network.",Course,2020-11-01 15:05 UTC,N/A,false,N/A,
React: Server-Side Rendering (2018),"Server-side rendering lets you optimize your applications to use client or server resources depending on network and device circumstances. Old device on a slow network? Render on the server.  New device, fast network? You should probably let the client do the work.  Some call the resulting architecture ""universal,"" others ""isomorphic,"" but the results are smooth. Learn about implementing server-side rendering, or SSR, in your React projects. Emmanuel Henri shows how to set up an SSR project with React and Next.js, add a centralized store with Redux, and configure custom routes with Express and Next.js. He wraps up the course with a discussion of code splitting, which can improve application performance.",Course,2018-11-23 01:38 UTC,N/A,false,N/A,
Creating a Serverless Application Using React in AWS,"React is one of the key technologies that the new and modern web is being built upon. In this course, instructor Brett McLaughlin shows you how React and a complete web development ecosystem work together in building applications. Brett goes through all the steps in getting your React app set up, deployed, connected, and supported. Next, he steps you through creating React components to organize and display your content. Brett teaches you how to add cloud services like a database using JSON data and encourages you to ensure your code works on the cloud platform you're targeting. He covers how to interact with AWS and DynamoDB through the command line, then how to create and use a DynamoDB table. Next, Brett goes into how to create, load, and test a new role that can execute Lambda functions and interact with DynamoDB. He walks you through creating and deploying an API gateway. Brett concludes by showing you how to connect your React code to an API Gateway endpoint.",Course,2023-05-24 22:19 UTC,N/A,false,N/A,
First Look: Python 3.9,"Python, like any modern language, is always evolving. In this course, instructor Claire Burn dives into Python 3.9, highlighting the new features, improvements, and deprecations packed into this release. Learn about the significant Python Enhancement Proposals (PEPs) included in Python 3.9, as well as how to distinguish which modules are new (and why they are notable). Discover which modules have been deprecated and why this was necessary. Plus, get tips for overcoming common challenges while porting from Python 2 to Python 3.9, or Python 3.x to Python 3.9.",Course,2021-04-21 04:18 UTC,N/A,false,N/A,
Delivering an Authentic Elevator Pitch,"Find out how to craft an authentic personal pitch while projecting competence and warmth—two key factors in making a great first impression. Instructor Tatiana Kolovou shares how building trust with people and making a positive first impression isn’t a matter of magic. Tatiana reveals how verbal and nonverbal behaviors can influence the way people react in an initial meeting, whether in person, over the phone, or online.",Course,2020-10-11 22:59 UTC,N/A,false,N/A,
Code Clinic: C#,"Successful programmers know more than just how to code. They also know how to think about solving problems. <i>Code Clinic</i> is a series of courses in which our instructors solve the same problems using different programming languages. In each course, instructors provide tips and tricks for working in a particular language and help you grasp why you might want to learn one language over another. Here, Anton Delsink works with C#. Throughout the course, Anton introduces challenges and then provides an overview of his solutions in C#. Challenges include topics such as geolocation, face recognition, and accessing peripherals. Visit other courses in the series to see how to solve the same challenges in languages like C++, JavaScript, PHP, Python, Ruby, Go, and Swift.",Course,2021-02-07 03:21 UTC,N/A,false,N/A,
LPIC-2 Linux Engineer (202-450): 6 System Security,"The LPIC-2 Linux Engineer (202-450) course is designed for IT Professionals who are seeking the LPIC-2 certification. This series of courses from ITProTV covers the skills required of any intermediate to advanced systems administrator who is tasked with supporting Linux in a production environment. This course, sixth in the series, focuses on system security. Learn how to build a router and configure port forwarding, with iptables, and review how to use iptables as a firewall. Explore building a FTP server with vsftpd and Pure-FTPd. Find out how to restrict access to SSH and enable certificate authentication in SSH. Go over how to use Fail2ban to block brute force attacks and scan for open ports with Nmap. Plus, dive into building a VPN server with OpenVPN and configuring an OpenVPN client.
 <br><br>
Note: This course was created by ITProTV. We are pleased to host this training in our library.",Course,2023-02-15 20:53 UTC,N/A,false,N/A,
Building Web APIs with ASP.NET Core,"Web APIs drive the most popular web and mobile apps, as well as internet-enabled devices ranging from fridges to phones. Curious about how to build a web API of your own? In this course, instructor Christian Wenz shows you how, taking you step by step through the process of building a web API with ASP.NET Core 3.1, the open-source framework for Windows, macOS, and Linux. Christian explains how routing works and how data is modeled in ASP.NET Core. He provides coverage of Entity Framework Core to help you grasp how data models in your projects connect to underlying databases. Plus, he covers essential topics such as API versioning, CRUD operations, securing your API, and more.",Course,2021-01-11 04:36 UTC,N/A,false,N/A,
Learning C#,"The C# language got its start on Windows, but today you can find it almost everywhere.  Whether it’s running on the cloud, to desktops with MacOS and Linux, to mobile operating systems like Android and iOS, C# has grown into a mature, powerful language for almost any programming purpose.
In this course, Joe Marini dives into the fundamentals of C#, starting with a basic overview of language constructs like program flow and data types. He then gets into more advance topics such as functions, object-oriented programming techniques, and string processing. After this course, you’ll have a better understanding of C#, and how its combination of power, simplicity, and expressiveness make it an extremely versatile programming language that can be used for almost any scenario.
<p>This course includes Code Challenges powered by CoderPad. Code Challenges are interactive coding exercises with real-time feedback, so you can get hands-on coding practice alongside the course content to advance your programming skills.</p>",Course,2023-06-01 03:25 UTC,N/A,false,N/A,
Figure Drawing: Tonal Rendering,"How can you make a good figure drawing into a great figure drawing? Give it drama with tonal rendering. This course—taught on the iPad Pro—provides you with step-by-step demonstrations that can help you enhance the dimensionality and drama of your figure drawings using tonal rendering techniques. Instructor Amy Wynne starts by demonstrating how to create a five-part tonal gradient, and then shows how to apply this to simple 3D geometric shapes such as an egg, a cylinder, and a block; these shapes serve as the building blocks for constructing your figures. Amy also shows how to build the figure from the inside out—from structure to tonality—and apply silhouette and camouflage using inspiring master drawings as examples. Upon completing this course, you'll be equipped with a few simple techniques that can help you add beautiful lights and shadows to your figure sketches.",Course,2020-04-10 15:29 UTC,N/A,false,N/A,
Cybersecurity with Cloud Computing,"More and more companies are migrating their applications and infrastructure to the cloud, shifting operational aspects to service providers such as Microsoft and Amazon. However, cloud computing is a shared responsibility, especially when it comes to keeping your data, users, and systems safe. In this course, Malcolm Shore outlines the major forms of cloud technology, its benefits and risks, and the cybersecurity standards and body of knowledge required to mitigate those risks. He introduces concepts such as software as a service (SaaS), platform as a service (PaaS), and infrastructure as a service (IaaS) and the different deployment models available. He then reviews offerings from Microsoft Azure, Amazon Web Services, and Google Apps. Malcolm also shows the Security as a Service (SecaaS) capability of each platform, which can be used to identify unauthorized access and put cloud security defenses like encryption, logging, and monitoring into place.",Course,2022-06-17 02:17 UTC,N/A,false,N/A,
Technology for Product Managers,"Product managers must know technology basics. They need to have the vocabulary to speak to engineers, UX designers, and executives-and translate messages between these very different stakeholders. A product manager should know how the internet works, how front end differs from back end, what the major programming languages are, and why web and mobile developers are so in demand. This course provides an overview of the basics, including terminology and trends that will affect your work and collaboration with your team.<br><br>

Instructor Cole Mercer reviews the fundamental building blocks of modern software applications-from the web that connects all the working parts, to the data, users, and the build tools that developers use every day. He discusses the differences between desktop, web, and mobile development, and reviews the role of version control systems in deployment and release.",Course,2023-08-07 17:05 UTC,N/A,false,N/A,
Cert Prep: Unity Certified Associate Game Developer Scripting with C#,"Become Unity certified and show employers you have the Unity skills they are looking for. Improve your chances of landing that dream job doing what you love most—making games, architectural visualizations, or films. This course helps you study for the sections of the Unity Certified Associate: Game Developer exam that deal with scripting and publishing. Instructor Alan Thorn covers the basics of scripting, demonstrating how to create a C# script in Visual Studio, print to the console, and create useful scripts that make 3D objects move and react. He also discusses making timed behaviors, generating path-finding data for helping nonplayer characters (NPCs) navigate environments intelligently, and using finite-state machines to help NPCs make decisions. Plus, learn how to create convincing patrol, chase, and attack states for an enemy character.",Course,2023-06-08 15:36 UTC,N/A,false,N/A,
Learning Kubernetes (2018),"Kubernetes is the world's most popular open-source container orchestration engine. It offers the ability to schedule and manage containers—Docker or otherwise—at scale. This course introduces developers, DevOps engineers, and IT pros to Kubernetes. First, learn how to get a Kubernetes environment up and running on Mac or Windows using Minikube, and understand the components for Kubernetes. Next, deploy a sample Kubernetes application and manage it with the Kubernetes dashboard. Instructor Karthik Gaekwad also shows how to deploy a more complicated application with a database and APIs. Then learn how to run jobs and cron jobs. Finally, explore more advanced topics, including production deployments, namespaces, monitoring and logging, and authentication and authorization.",Course,2022-03-01 23:54 UTC,N/A,false,N/A,
Web Security: OAuth and OpenID Connect (2018),"While many technical professionals claim to know and understand OAuth, reality often suggests otherwise. Implementing the proper grant types and the required flows while securely protecting your secrets is challenging at best and catastrophic at worst. Fundamentally, professionals often struggle with OAuth because they misunderstand what it is, what use cases it is particularly good and bad at, and how to integrate it smoothly and safely into their systems. In this course, review the basics of OAuth 2.0 and OpenID Connect, and learn how to use them to authenticate your applications. Learn about tokens, scopes, and claims; OAuth flows; common security considerations; and more.",Course,2021-10-31 23:34 UTC,N/A,false,N/A,
WordPress: Speeding Up Your Site,"Slow loading speeds equal lost customers. In this course, instructor Patrick Rauland walks through steps you can take to make a typical WordPress site lightning fast. Patrick explains why speed is so important, then shows you how to check and monitor your speed. He describes how websites slow down and how to identify static and dynamic WordPress sites. Patrick goes into hosting and all the ways a good website host can speed up your site. He covers ways you can make sure media isn’t slowing down your site, such as optimizing images, using a content delivery network (CDN), and offloading audio and video files. Patrick shows you how to balance fast versus functional, in making sure plugins don’t slow down your site. After going over how to make your database more efficient, Patrick concludes with a discussion of caching and how “busting” your cache can speed up your site.",Course,2023-07-26 19:43 UTC,N/A,false,N/A,
Starting a Memorable Conversation,"Both in business and personal life, having the skill to approach a stranger or strike up a conversation with an acquaintance in a new context can be very useful. Memorable conversations can open doors and change career trajectories, but being the person to speak first doesn’t come naturally to all of us. In this course, author Tatiana Kolovou shares a formula for starting meaningful exchanges in any situation and teaches how to conduct an appropriate and memorable conversation. You can also learn about how to avoid common difficulties and find the right way to end a conversation.",Course,2021-01-10 06:29 UTC,N/A,false,N/A,
Raspberry Pi Essential Training,"In this introductory class to the Raspberry Pi, technologist Mark Niemann-Ross explains the vocabulary associated with this single-board computer, then shows you how to plug in peripherals and perform basic computing tasks. Mark first describes how the Raspberry Pi compares to other computers and how it can be used as a media server, musical instrument, robotics controller, and more. He covers the members of the Raspberry Pi family and how to select the one that is right for you and the accessories that you need to use it effectively. Mark walks you through connecting your Raspberry Pi to wi-fi and ethernet, as well as getting it started. After examining operating systems for Raspberry Pi, he goes into why a virtual networking computer (VNC) for Raspberry Pi can be very helpful and how you can enable and use one. Mark discusses sound on your Raspberry Pi and how to use and control the GPIO board. After going over Raspberry Pi hardware, he dives into the Raspberry Pico microcontroller, then finishes up with how to run the Raspberry Pi OS on other computers.
<br><br>
Note: This course was created by Mark Niemann-Ross. We are pleased to host this training in our library.",Course,2023-07-16 16:19 UTC,N/A,false,N/A,
AWS for Architects: High Availability and Continuous Deployment,"Discover how to get your apps in front of users as soon as possible—and ensure that those same apps are highly available—by leveraging continuous deployment (CD) and high availability (HA) strategies. This course shows IT pros how to use AWS CD and HA services, techniques, and tools. Instructor Lynn Langit covers key concepts around both CD and HA, including the impact of AWS regions and availability zones on HA design. She also goes over key services such as Step Functions, shows how to work with common application patterns, and discusses how to implement CD and HA. This course can also prepare you for the High Availability and Business Continuity domain in the AWS Certified Solutions Architect – Professional exam.",Course,2018-12-07 14:46 UTC,N/A,false,N/A,
Supply Chain Foundations: Analytics,"Almost everything you own or consume—food, electronics, furniture, medicine, clothes—found its way to you via a supply chain. Any problems with a supply chain can not only disrupt your life, but in the case of medicines or other vital supplies, possibly threaten it. Even when supply chains are running soothing, companies still look for ways to be even more efficient with their time, money, and resources, and that’s where supply chain analytics come in. In this course, Eddie Davila covers the fundamentals of supply chains and analytics. He takes a look at how organizations develop a supply chain analytics program, and some of the analytics tools and methods used to improve supply chains, along with a host of other topics like forecasting, supply chain mapping, supply chain disruptions, and risk management. As companies turn more and more toward data and automation, having a firm grasp on supply chain analytics can help make you a highly-coveted professional.",Course,2022-05-11 22:20 UTC,N/A,false,N/A,
Fusion 360: Designing for Metal,"If you're designing metal parts, you'll need to do things differently than you would for other materials and processes. This course shows how to use Autodesk Fusion 360—the affordable cloud-powered CAD and CAM tool that works like more expensive, industry-focused tools—to build effective designs specifically for subtractive manufacturing in metal. Thom Tremblay shows how to build solid designs, simulate how the model will hold up to the stress of production and use, render the design for presentation, and finalize it for manufacturing. The workflows showcased in this course are tailored to help the nonprofessional CAD user, and the maker, to be more effective and quickly have access to the tools that a few years ago were only available to the few and at an astronomical price.",Course,2021-09-27 19:49 UTC,N/A,false,N/A,
CONTENT METADATA NO LONGER EXISTS - urn:li:lyndaCourse:2882171,CONTENT METADATA NO LONGER EXISTS - urn:li:lyndaCourse:2882171,Course,2021-08-21 00:48 UTC,N/A,false,N/A,
Ken Blanchard on Servant Leadership,"Self-serving leaders can be both destructive and highly ineffective. By making leadership all about them, they create a negative working environment where employees often lack the motivation to produce their best work. In this concise course, Ken Blanchard—a pioneer in the leadership space—shares his insights on servant leadership. Ken discusses practical ways for leaders to implement this approach in their organization, covering habits of servant leaders, how to create a servant leader culture, and how to manage effectively. Upon completing this course, you'll have a greater understanding of how to operate as a servant leader, and shift your focus from yourself to your employees and what you're ultimately trying to accomplish.",Course,2020-03-01 18:32 UTC,N/A,false,N/A,
Nano Tips for Developing Magnetic Charisma with Shadé Zahrai,"Welcome to our <i>Nano Tips</i> series, where LinkedIn Learning creators deliver impactful lessons in literally seconds. In this installment, find out why charisma is such a valuable skill and how you can develop your own charisma with ease, exploring key insights from award-winning leadership strategist and peak performance specialist Shadé Zahrai.<br><br>Gather strategies to build authentic charisma to start creating better first impressions and new connections today. Get tips on energizing others with charismatic presence and magnetic communication. Along the way, Shadé shows you techniques for using eye contact, pauses, presentation starts, tension-building tools, simplified language, genuine care, and more.",Course,2023-12-31 00:40 UTC,N/A,false,N/A,
Presentation Tips for Pitching to Investors,"Landing a meeting with investors is a big opportunity—and a key test of your business. Investors ask tough questions. The answers can define your future. This course is all about preparing and delivering a rock-solid pitch that makes people want to invest in your company. Learn how to define the unique benefits of your product, describe your business model, and tell the story of your “why.” Instructor Jessica Chen—a public speaking and media relations consultant—then introduces tips for the actual presentation, including responding to your audience, answering questions, and being authentic. She leaves you with a final pitch checklist that will ensure you have all the elements of your pitch nailed down before the big day.",Course,2020-10-08 22:29 UTC,N/A,false,N/A,
Apple Watch Tips and Tricks (2019),"Apple Watch has evolved. The latest watchOS makes it even more convenient to manage messages, activities, and notification directly from your device. But even if you wear one daily, you might not be using all of its most helpful features. Get the most out of your Apple Watch with these practical tips and tricks. Garrick Chow explores the features and capabilities of the latest Apple watchOS, including messaging, app management, voice control with Siri, staying fit and safe, and other valuable pointers. He also shows how to customize your unlock settings and haptic strength, so the Apple Watch responds perfectly to your touch.",Course,2020-11-16 23:45 UTC,N/A,false,N/A,
Artist at Work: Complementary Colors,"Take a look over the shoulder of an artist at work. Mary Jane Begin, an award-winning illustrator and Rhode Island School of Design professor, sits down at the drawing board and explains how complementary colors—colors on opposite sides of the color wheel—can make your art, illustrations, and designs more compelling and vibrant. Learn how to layer colors of different hues and translucencies, play with light and shadow, and subtract color to create a sense of form. Plus, learn to neutralize a color's intensity simply by mixing it with its complement. Mary Jane illustrates these concepts through pastel on paper, but they can be applied to all types of media including digital endeavors.<br><br>Mary Jane uses the following materials in this course:
<ul>
<li>Arches 140 lb hot press paper</li>
<li>Tube watercolors- Winsor & Newton Cotman brand</li>
<li>Paper stumps for blending</li>
<li>Pastels- a variety of stick and pencil forms (including Conte pastel pencils) </li>
<li>Short, fat, fine-bristle Winsor & Newton #2 and #4 brushes (for scrubbing color off) </li>
<li>Sceptre Gold II sable/synthetic blend #3, #6, and #10 brushes</li>
<li>Winsor & Newton Cotman brand 25 mm/1 in. flat brush (for washes) </li>
</ul>",Course,2020-04-20 16:53 UTC,N/A,false,N/A,
Java Practice: Collections,"<p>Java is a versatile, object-oriented programming language that is designed to run on a wide variety of platforms. Any machine that has a Java Virtual Machine, or JVM, can run Java apps. For that reason, Java is commonly used in a wide range of applications, including web, mobile, and desktop. Many of the apps you know and love were likely written in Java! In this course, instructor Todd Perkins, who has developed more than a dozen popular apps and games, uses a series of practical challenges to test your knowledge of Java collections and improve your programming problem-solving skills.</p>
 
<p>This course includes Code Challenges powered by CoderPad. Code Challenges are interactive coding exercises with real-time feedback, so you can get hands-on coding practice alongside the course content to advance your programming skills.</p>",Course,2024-01-27 13:18 UTC,N/A,false,N/A,
Addiction: A Community Issue,"Addiction is a public health issue that impacts us both at work and at home. But while this problem is widespread, the stigma surrounding addiction can make seeking help a challenge. This brief course was designed to help demystify addiction and provide employees with strategies, tools, and resources for helping themselves and others in their community.<br/><br/>Dr. Srini Pillay, a Harvard-trained psychologist, details the difference between recreational behavior and addiction to help you determine whether you or someone you know should seek help. Dr. Pillay shares how to address addiction in yourself or an employee, as well as how to appraise what level of care you or others need and when to approach specific care providers. He explains how addiction can also be present in our relationships with work, technology, food, shopping, and other seemingly benign areas of life. Plus, he helps you evaluate the merits of mobile apps and other new approaches for managing addiction.",Course,2021-01-29 23:50 UTC,N/A,false,N/A,
